"variable","name","definition","about","source"
"du_cty","Madison Dwelling Units ","Non-campus dwelling units in the City of Madison.","Non-campus dwelling units in the City of Madison property database.   In residential group quarters each deliverable mail address is counted as a dwelling unit. ","City of Madison Planning Division, Parcel summary database, received 7/9/2023"
"du_cmps","Campus Dwelling Units","Campus dwelling units in University of Wisconsin or Edgewood College residential housing.","Campus dwelling units in University of Wisconsin or Edgewood College residential housing.  These counts include fraternities and sororities that are intended for student occupants.  Each deliverable mail address in a residential group quarters (e.g. dormitory) was counted as a dwelling unit.","City of Madison Planning Division, Parcel summary database, received 7/9/2023"
"asst_unts","Madison Subsidized Rental Units","Rental dwelling units receiving government subsidies.","Tabulations include the following categories of housing assistance: Public Housing CDA (Community Development Authority); Private Projects: Section 8 Project Subsidies and Section 42 Tax Credits; and other project subsidized by City or other Federal funding.","City of Madison Planning Division, Parcel summary database, received 7/9/2023"
"avg_huval","Owner Occupied Houses: Average Value","Average assessed value of single family dwelling unit, owner occupied houses.","Average assessed value (land and improvements) among single family owner occupied housing units.","City of Madison Planning Division, Parcel summary database, received 7/9/2023"
"sqft_val","Owner Occupied Houses: Square Foot Value","Square foot value of single family dwelling unit, owner occupied houses.","Total housing value (land and improvements) among single family owner occupied housing units divided by the total finished floor area.","City of Madison Planning Division, Parcel summary database, received 7/9/2023"
"avg_n_hval","Non-Owner Occupied Houses: Average Value","Average assessed value of single family dwelling unit, non-owner occupied houses.","Average assessed value (land and improvements) among single family non-owner occupied housing units.","City of Madison Planning Division, Parcel summary database, received 7/9/2023"
"sqft_n_val","Non-Owner Occupied Houses: Square Foot Value","Square foot value of single family dwelling unit, non-owner occupied houses.","Total housing value (land and improvements) among single family non-owner occupied housing units divided by the total finished floor area.","City of Madison Planning Division, Parcel summary database, received 7/9/2023"
"avg_c_hval","Condos: Average Value","Average assessed dwelling unit value of condominiums.","Average assessed value among condominiums.","City of Madison Planning Division, Parcel summary database, received 7/9/2023"
"sqft_c_val","Condos: Square Foot Value","Square foot value of condominiums.","Total assessed value divided by the total finished floor area (with common areas, unit parking, and storage excluded). ","City of Madison Planning Division, Parcel summary database, received 7/9/2023"
"yrblt_mdn","Median Year Built","Median year built for all dwelling units including single household dwelling units, multi-household units, and some residential group quarters.","Campus dormitories are excluded from the Median Year Built tabulations.","City of Madison Planning Division, Parcel summary database, received 7/9/2023"
